{
  "rig_id": "certarig-wave1-sim",
  "revision": "sim-twin-of-phase3-wave1",
  "sample_interval_ms": 20,
  "pressure_abort_bar": 4.2,
  "hardware": {
    "mode": "simulator",
    "i2c_bus": 1,
    "ads1115_address": 72,
    "valve_output_gpio": 23,
    "emergency_stop_gpio": 24,
    "emergency_stop_active_high": true,
    "relay_feedback_gpio": null,
    "output_active_high": true,
    "simulator": {
      "seed": 7,
      "time_scale": 1.0,
      "noise_bar": 0.005,
      "noise_l_min": 0.02,
      "lag_s": 0.12
    }
  },
  "channels": [
    {
      "channel_id": "pressure_emulator",
      "kind": "analog",
      "adc_channel": 0,
      "unit": "bar",
      "raw_min_v": 0.0,
      "raw_max_v": 3.302,
      "engineering_min": 0.0,
      "engineering_max": 10.0,
      "valid_min": 0.0,
      "valid_max": 10.0,
      "safe_min": 0.0,
      "safe_max": 4.2,
      "calibration_id": "W1-P1-20260910",
      "required": true,
      "warning_max": 3.8
    },
    {
      "channel_id": "flow_emulator",
      "kind": "analog",
      "adc_channel": 1,
      "unit": "L/min",
      "raw_min_v": 0.0,
      "raw_max_v": 3.3,
      "engineering_min": 0.0,
      "engineering_max": 20.0,
      "valid_min": 0.0,
      "valid_max": 20.0,
      "safe_min": 0.0,
      "safe_max": 15.0,
      "calibration_id": "W1-P2-20260910",
      "required": true,
      "warning_max": 13.0
    }
  ],
  "description": "Digital twin of the Phase 3 wave-1 dry bench. Same channels and limits; simulated hardware."
}
